{
    "prompt_pattern": "What now\\?|\\r?\\n>",
    "candidate_verbs": [
        "examine",
        "take",
        "read",
        "look inside",
        "wear",
        "eat",
        "drink",
        "open",
        "close",
        "unlock",
        "lock",
        "push",
        "pull",
        "turn on",
        "turn off"
    ],
    "creature_words": [
        "horse",
        "pony",
        "mare",
        "stallion",
        "knight",
        "orc",
        "guard",
        "soldier",
        "man",
        "woman",
        "person",
        "peasant",
        "troll",
        "goblin",
        "dwarf",
        "elf",
        "creature",
        "beast",
        "monster",
        "demon"
    ],
    "hard_failure_patterns": [
        "you can'?t",
        "can'?t see",
        "can'?t do that",
        "don'?t understand",
        "you don'?t have",
        "nothing happens",
        "that'?s not something",
        "there('?s| is) no \\w+ here",
        "i don'?t know (that word|what)",
        "don'?t need to use the word",
        "You can't eat that",
        "You can't drink that",
        "You can't wear that",
        "You can't take that",
        "You can't open that",
        "You can't close that",
        "Don't be (silly|rediculous|stupid)",
        "Yeuch!",
        "What a peculiar idea.",
        "Cannot drink",
        "Strange concept",
        "probably just scenery",
        "i don'?t know where"
    ],
    "soft_failure_patterns": [
        "right now",
        "not now",
        "(you'?re|you are) already (wearing|carrying|holding)",
        "while (you'?re|you are) (wearing|carrying|holding)",
        "can'?t do that yet",
        "not yet",
        "can'?t[^.\\n]{0,80}because"
    ],
    "end_state_patterns": {
        "death": [
            "you have died",
            "you are dead",
            "killed"
        ],
        "finished": [
            "congratulations",
            "you have finished",
            "the end"
        ],
        "score": [
            "you score \\d+ out of \\d+"
        ]
    },
    "navigation": {
        "fast_nav_command": "run to {target}",
        "full_nav_command": "go to {target}"
    },
    "npc_commands": {
        "wait_for_command": "wait for {npc}"
    },
    "hints": [
        "Say hello to denzyl as he can help you with your quest."
    ]
}